ID,Title,Url,Source,Description,Date,Article,Sentiment
44,Indian Shares End Lower,http://online.wsj.com/article/DN-CO-20140403-004858.html,The Wall Street Journal,"Among major stock losers, State Bank of India--the country's biggest lender--declined 2% to 1895.35 rupees, while Axis Bank also fell 2% to 1437.25 rupees. The rupee was trading weaker against the U.S. dollar. In late spot market trading ...",2014-04-03T09:06:29Z,"Indian shares snapped out of a six-session winning streak to end lower Thursday as a weak services activity report prompted investors to book profits. Nevertheless, the losses were marginal as sentiment remains upbeat on growing hopes of a business-friendly government taking charge following general elections. The Bombay Stock Exchange's benchmark S&P BSE Sensex ended down 0.2% at 22509.07 points after hitting a fresh high of 22620.65 points earlier in the session. The National Stock Exchange's 30-stock Nifty index also fell 0.2% to 6736.10 points. ""This is a healthy correction,"" said Sunil Pachisia, vice president of institutional equities at the brokerage Pratibhuti Viniyog. ""If we have to see further upside, then it is very much required that some correction should take place,"" he added. The benchmark index has hit successive record highs in recent sessions, gaining 6% over the past month. Investors are hoping that the country's main opposition, Bharatiya Janata Party, which surveys show is leading the race to form the next government, would speed up economic reforms. Earlier Thursday, an HSBC/Markit survey showed India's services activity contracted for the ninth successive month, raising concerns about the economy which is growing at its weakest pace in a decade. Services contribute about 60% to India's gross domestic product. Eight of the Bombay Stock Exchange's 12 sector indices ended lower. The S&P BSE bank index fell 1.1% after rallying about 15% over the past one month. Among major stock losers, State Bank of India--the country's biggest lender--declined 2% to 1895.35 rupees, while Axis Bank also fell 2% to 1437.25 rupees. The rupee was trading weaker against the U.S. dollar. In late spot market trading, a dollar was buying 60.17 rupees compared with 59.90 rupees at Wednesday's close.",Negative
45,"Loan Week, March 21-27","http://www.financeasia.com/News/381076,loan-week-march-21-27.aspx",Finance Asia,Axis Finance has sealed a Rs7.3 billion one-year credit facility though sole bookrunner and mandated lead arranger Axis Bank. The facility is fully underwritten by the lead. Final allocations saw participant Punjab & Sind bank provide Rs3 billion while ...,2014-03-27T15:27:01Z,Axis Finance has sealed a Rs7.3 billion one-year credit facility though sole bookrunner and mandated lead arranger Axis Bank. The facility is fully underwritten by the lead. Final allocations saw participant Punjab & Sind bank provide Rs3 billion while Axis Bank and participant Bank of Baroda took Rs2.3 billion and Rs2 billion respectively. Proceeds are for onward lending purposes.,Positive
46,Indian Shares End Lower,http://online.wsj.com/article/DN-CO-20140403-004858.html,The Wall Street Journal,"Among major stock losers, State Bank of India--the country's biggest lender--declined 2% to 1895.35 rupees, while Axis Bank also fell 2% to 1437.25 rupees. The rupee was trading weaker against the U.S. dollar. In late spot market trading ...",2014-04-03T09:06:29Z,"Indian shares snapped out of a six-session winning streak to end lower Thursday as a weak services activity report prompted investors to book profits. Nevertheless, the losses were marginal as sentiment remains upbeat on growing hopes of a business-friendly government taking charge following general elections. The Bombay Stock Exchange's benchmark S&P BSE Sensex ended down 0.2% at 22509.07 points after hitting a fresh high of 22620.65 points earlier in the session. The National Stock Exchange's 30-stock Nifty index also fell 0.2% to 6736.10 points. ""This is a healthy correction,"" said Sunil Pachisia, vice president of institutional equities at the brokerage Pratibhuti Viniyog. ""If we have to see further upside, then it is very much required that some correction should take place,"" he added. The benchmark index has hit successive record highs in recent sessions, gaining 6% over the past month. Investors are hoping that the country's main opposition, Bharatiya Janata Party, which surveys show is leading the race to form the next government, would speed up economic reforms. Earlier Thursday, an HSBC/Markit survey showed India's services activity contracted for the ninth successive month, raising concerns about the economy which is growing at its weakest pace in a decade. Services contribute about 60% to India's gross domestic product. Eight of the Bombay Stock Exchange's 12 sector indices ended lower. The S&P BSE bank index fell 1.1% after rallying about 15% over the past one month. Among major stock losers, State Bank of India--the country's biggest lender--declined 2% to 1895.35 rupees, while Axis Bank also fell 2% to 1437.25 rupees. The rupee was trading weaker against the U.S. dollar. In late spot market trading, a dollar was buying 60.17 rupees compared with 59.90 rupees at Wednesday's close. ",Negative
47,Mkts show no sign of looking back as indices scale new highs,http://www.hindustantimes.com/business-news/sensex-bse-nse-stocks-trade-nifty/article1-1201330.aspx,Hindustan Times,"State-run SBI jumped 3.41%. NTPC was the next best at 3.29%. Bharti Airtel was up 2.19%. Axis Bank rose 2.16%, Coal India 2.13%. Tata Steel, SSLT, RIL Dr Reddy's Lab gained over 1%. ""It seems participants are taking advantage of any pause or decline as an ...",2014-03-28T05:17:23Z,"With foreign fund inflows continuing unabatedly, the BSE benchmark Sensex scaled a new high for the fifth straight day on Friday but ended a little lower at 22,339.97, which is its fresh closing record. The NSE Nifty also shot up by 54.15 points to record closing high of 6,695.90, after hitting a life-time high of 6,702.60 intra-day. The rally is stocks was also aided by strengthening rupee which rose to sub-60 level at 59.90 for the first time in eight months on Friday. After resuming the day better, the BSE 30-share barometer traded in the negative terrain for a brief time before setting all-time record of 22,363.97 points intra-day. It finally settled the day at 22,339.97, 125.60 points or 0.57% higher than its previous close. Market players attributed the surge to steady fund flows for the past 12 trading days in a row. According to market regulator Sebi's data, foreign institutional investors (FIIs) have poured in Rs. 18,073 crore since March 12. Barring Tuesday, when it closed lower by a marginal 0.27 points, bourses have been climbing new high all through this week. The Sensex this week also logged the biggest gain of 584.65 points in three weeks. Buying was seen across the board today as all 12 sectoral indices closed with gains ranging from 0.24-3.02%, with power, realty, metal and banking segments leading. Tata Power at 4.54% was the biggest Sensex gainer, while Hindalco surged 4.07%. State-run SBI jumped 3.41%. NTPC was the next best at 3.29%. Bharti Airtel was up 2.19%. Axis Bank rose 2.16%, Coal India 2.13%. Tata Steel, SSLT, RIL Dr Reddy's Lab gained over 1%. ""It seems participants are taking advantage of any pause or decline as an entry opportunity to avoid the feeling of being left out. Besides, majority of sectoral indices (expect IT and pharma) are participating in this rally,"" said Jayant Manglik, President, Retail Distribution, Religare Securities.",Positive
48,Market ends with muted loss amid profit booking,http://www.commodityonline.com/news/market-ends-with-muted-loss-amid-profit-booking-58427-3-58428.html,Commodity Online,"Market breadth remained negative amid 1279 advances and 1509 decline stocks. From the Nifty weight perspective, key losers were Reliance Industries Ltd (NSE: RELIANCE), Axis Bank Ltd (NSE: AXISBANK) and State Bank of India Ltd (NSE: SBIN) while key gainers ...",2014-04-03T10:10:54Z,"Indian capital market opened gap up amid positive global cues. Indices soon got dragged in red led by profit booking in Banking and Capital Goods stocks. On the flip side, Metal and Pharma stocks witnessed gain in early trade. Indices extended losses in afternoon session. European markets also opened on weak note. Nifty index fell below its key psychological support of 6700 level in afternoon session. However, market recovered most of losses in late trade back of short covering. Market breadth remained negative amid broader weakness. Midcap and Smallcap indices closed with loss of 0.39% and 0.18% respectively. Benchmark indices closed with muted loss. Sensex closed at 22509.07 with the loss of 42.42 points and at NSE Nifty closed at 6736.10 with the loss of 16.45 points at the end of the day. BSE MIDCAP index closed at 7170.75 with the loss of 28.17 points and BSE SMALLCAP index closed at 7207.45 with the loss of 12.91 points. In percentage term key losers were Bank of Baroda Ltd (NSE: BANKBARODA), Bharat Heavy Electricals Ltd (NSE: BHEL) and DLF Ltd (NSE: DLF) while key gainers were Asian Paints Ltd (NSE: ASIANPAINT), Jindal Steel & Power Ltd (NSE: JINDALSTEL) and Hindustan Unilever Ltd (NSE: HINDUNILVR). On sectoral front major selling was seen in Banking & Financial, Oil & Gas, Capital Goods and Power sectors while major buying was seen in Pharma, FMCG, Metal and Consumer Durable sectors. Market breadth remained negative amid 1279 advances and 1509 decline stocks. From the Nifty weight perspective, key losers were Reliance Industries Ltd (NSE: RELIANCE), Axis Bank Ltd (NSE: AXISBANK) and State Bank of India Ltd (NSE: SBIN) while key gainers were ITC Ltd (NSE: ITC), Hindustan Unilever Ltd (NSE: HINDUNILVR) and Infosys Ltd (NSE: INFY).",Negative
49,IFC Finance : Financing to National Development Bank to Boost Financial Access in Sri Lanka,http://www.4-traders.com/news/IFC-Finance--Financing-to-National-Development-Bank-to-Boost-Financial-Access-in-Sri-Lanka--18184939/,4 Traders,"UAE ($25 million), HSBC ($25 million), Standard Chartered Bank ($20 million), Axis Bank, India ($15 million), Doha Bank, Qatar ($10 million), and Bank Muscat, Oman ($10 million). Additionally, $70 million will be raised from other international ...",2014-03-31T17:02:29Z,"IFC, a member of the World Bank Group, is providing a $125 million syndicated financing package to Sri Lanka's National Development Bank PLC (NDB) to expand access to finance for over 50,000 micro, small, and medium enterprises over the next four years. The package includes a loan from IFC of $20 million, and a $105 million syndicated facility from a group of international banks including  Union National Bank, UAE ($25 million), HSBC ($25 million), Standard Chartered Bank ($20 million),  Axis Bank, India ($15 million),  Doha Bank, Qatar ($10 million),  and Bank Muscat, Oman ($10 million).  Additionally, $70 million will be raised from other international developmental financial institutions by June 2014.",Positive
50,"India reduces tariff value of gold, silver",http://www.livemint.com/Money/FBEIoMAotCF5xkCDISJ8JN/India-reduces-tariff-value-of-gold-silver.html,Live Mint,"The commerce ministry has asked the finance ministry to relax curbs on gold imports. Meanwhile, the Reserve Bank of India (RBI) has allowed more banks, including Axis Bank and Kotak Mahindra Bank, to import gold under the 80:20 scheme, a move seen as a ...",2014-04-01T16:11:12Z,"The Indian government has reduced the import tariff value on gold to $421 per 10 grams from $445 per 10 gram earlier. Also, the import tariff value—the base price at which customs duty is determined to prevent under-invoicing—in case of silver has been reduced to $644 per kilogram from $694 per kilogram earlier, a notification by the Central Board of Excise and Customs said. The tariff value is revised on a fortnightly basis after analyzing the global price trend. Gold is the second largest import item for India after petroleum. The government had taken several measures to curb gold shipments to address the high current account deficit (CAD). These measures include raising the import duty to 10% on the metal and also made it mandatory for traders to export 20% of the imported gold, thereby creating supply crunch in the domestic market. According to the jewellers body, total gold imports are expected to be not more than 550 tonnes this fiscal due to these restrictions, from 845 tonnes in the last fiscal. The commerce ministry has asked the finance ministry to relax curbs on gold imports. Meanwhile, the Reserve Bank of India (RBI) has allowed more banks, including Axis Bank and Kotak Mahindra Bank, to import gold under the 80:20 scheme, a move seen as a precursor to easing restrictions on inward shipments of the metal. On Monday, finance minister P. Chidmabaram had indicated that government may further ease restrictions on gold imports after Tuesday’s monetary policy by RBI as CAD has moderated to about $35 billion.",Positive
51,Jubilant Energy agrees $15m loan,http://www.stockmarketwire.com/article/4782635/Jubilant-Energy-agrees-15m-loan.html,Stock Market Wire,"StockMarketWire.com - Jubilant Energy has agreed a $15m foreign currency loan with Axis Bank, Singapore branch. The tenor of the Loan is six years with a capital moratorium period of four and a half years and with repayment commencing thereafter in four ...",2014-03-31T08:19:56Z,"Jubilant Energy has agreed a $15m foreign currency loan with Axis Bank, Singapore branch. The tenor of the Loan is six years with a capital moratorium period of four and a half years and with repayment commencing thereafter in four semi-annual instalments. The loan will bear interest at a rate of 6 month US dollar LIBOR plus 570 basis points per annum, a processing fee of 9% and other nominal charges. These funds will be applied for general corporate purposes including debt repayments and servicing. The loan is secured by a corporate guarantee of Jubilant Enpro Private Limited, the ultimate holding company of the company and which is jointly owned and controlled by Shyam Sunder Bhartia and Hari Shanker Bhartia.",Positive
52,"Sensex, Nifty end higher; metal, tech stocks gain",http://www.hispanicbusiness.com/2014/3/24/sensex_nifty_end_higher_metal_tech.htm,Hispanic Business,Shares had fallen 7.4 per cent this month as of Thursday. Axis Bank rose 2.7 per cent on speculation that its weightage in FTSE indexes is due to increase when the index provider rejigs the composition of its benchmarks after the close of ...,2014-03-24T09:54:08Z,"The BSE Sensex and the National Stock Exchange Nifty edged higher on Friday, but continued to stay away from their record highs hit early in the week, as investors booked profits in some recent outperformers such as Oil and Natural Gas Corp, while buying into relative underperformers such as Tata Motors. Both the Nifty and the Sensex hit record highs on Tuesday, bolstered by continued buying from foreign investors, with net purchases of $117.87 million on Thursday, their 23rd buying session in the previous 24. Still, some of the momentum has waned. Nifty ended the week down 0.2 per cent, its second consecutive week of falls, and 1.2 per cent away from its record high of 6,574.94 hit on Tuesday. Profit-taking after a strong rally, and some global factors, including a bout of selling tied to concerns that the US Federal Reserve would raise interest rates earlier than expected, have pressured shares. ""We are cautiously optimistic in the near term. The undercurrent is positive, but profit-taking is expected in select sectors and stocks. We will continue to see sectoral rotations-like that we saw in information technology,"" said Deven Choksey, managing director at K R Choksey Securities. ""We may see fresh positions building up after the monthly derivatives contract expiry, in the coming week."" The Sensex on Friday closed 13.66 points, or 0.06 per cent, higher at 21,753.75. It lost 0.26 per cent this week. The Nifty closed up 10.10 points, or 0.16 per cent, at 6,493.2. Relative underperformers in the recent rally continued to gain, with Tata Motors up 2.5 per cent after falling 8.9 per cent this month as of Thursday's close. Meanwhile, Tata Consultancy Services rose 0.9 per cent, after being hit earlier this week after saying revenue growth could slow this quarter from the previous quarter. Shares had fallen 7.4 per cent this month as of Thursday. Axis Bank rose 2.7 per cent on speculation that its weightage in FTSE indexes is due to increase when the index provider rejigs the composition of its benchmarks after the close of markets on Friday. The speculation on FTSE offset pressure earlier in the day, when Axis Bank shares fell as much as 2.6 per cent, as the government raised more than $900 million by selling a nine per cent stake in the bank. However, shares speculated to be losing some weightage in FTSE indexes fell. Reliance Industries fell 2.2 per cent. ONGC fell 2.98 per cent, with some profit-taking hitting the stock after gaining 8.4 per cent this month as of Thursday's close. Blue chips broadly recovered from Thursday's fall, with State Bank of India up 1.44 per cent after losing 1.81 per cent in the pervious session.",Negative
53,Fiscal deficit likely within 5.1%: Citi,http://news.in.msn.com/business/fiscal-deficit-likely-within-51percent-citi,MSN India,"The Citigroup report further said that although the government may not fully achieve its FY14 divestment targets, the recent stake sale in SUUTI holdings (Axis bank Rs 5500 crore) and successful introduction of CPSE ETF (about Rs 4200 crore) augurs well ...",2014-04-01T14:23:49Z,"New Delhi: India’s fiscal deficit for 2013—14 fiscal is likely to be in the range of 5 — 5.1 per cent of the GDP, global financial major Citigroup said today. While the April—February deficit is pegged at 5.3 per cent of GDP, the final print may be a tad lower due to revenue push and expenditure cuts seen in March, the last month of 2013—14 fiscal year, it said. The official data showed yesterday that the fiscal deficit widened to Rs 5,99,299 crore in the April—February period of FY14, or 114.3 per cent of the target. “While the revenue push in March could result in the FY14 full—year deficit coming in a tad lower at 5—5.1 per cent of GDP,” Citigroup said in a research note, adding that the new government’s budget would be a key factor to watch. Fiscal Deficit in April—February stood at 5.3 per cent of GDP, well above the government’s estimate of 4.6 per cent of GDP stated in the Interim Budget. The increase can largely be attributed to both slower revenue growth and higher expenditure growth. After taking over as Finance Minister in August 2012, Chidambaram had drawn up a financial consolidation road map to lower the fiscal deficit to 4.8 per cent of GDP in 2013—14, 4.2 per cent in 2014—15 and 3.6 per cent in 2015—16. The Citigroup report further said that although the government may not fully achieve its FY14 divestment targets, the recent stake sale in SUUTI holdings (Axis bank Rs 5500 crore) and successful introduction of CPSE ETF (about Rs 4200 crore) augurs well for subsequent years.",Average
54,Govt may further ease restrictions on gold import soon: FM,http://freepressjournal.in/govt-may-further-ease-restrictions-on-gold-import-soon-fm/,freepressjournal.in,"In January this year, they were USD 1.72 billion. Earlier this month, the RBI allowed more banks, including Axis Bank and Kotak Mahindra Bank to import gold under the 80:20 scheme. Under the 80:20 scheme introduced on August 14, nominated agencies could ...",2014-03-31T13:13:25Z,"Finance Minister P Chidmabaram today indicated that government may further ease restrictions on gold imports after tomorrow’s monetary policy by RBI as Current Account Deficit has moderated to about USD 35 billion. “Some relaxations were made a few days ago when more banks were allowed to import gold. We could consider some more relaxations in consultation with RBI,” he said while releasing the year-end report on economy. “Let the RBI’s monetary policy be announced tomorrow and then we will consider whether some relaxation can be done,” he said. Emphasising that the economy today is far more stable and far stronger than what it was 20 months ago, he said, CAD is expected to come down about USD 35 billion during the current fiscal. It was at a record high of USD 88.2 billion or 4.8 per cent of GDP as gold imports soared 845 tonnes last fiscal. In order to restrict CAD, the government took measures to curb gold import. The government raised import duty on the precious metal three times taking it to 10 per cent and also made it mandatory to export 20 per cent of the total gold imported. Following this gold imports came down to 19 tonnes in November from a peak of 162 tonnes in May. The CAD, too, was brought down to 3.1 per cent in April-September of current fiscal, from 4.5 per cent in the same period last year. Gold imports have fallen substantially after the restrictions. Gold and silver imports declined 71.4 per cent to USD 1.63 billion in February. Imports of gold and silver in February 2013 stood at USD 5.24 billion. In January this year, they were USD 1.72 billion. Earlier this month, the RBI allowed more banks, including Axis Bank and Kotak Mahindra Bank to import gold under the 80:20 scheme Under the 80:20 scheme introduced on August 14, nominated agencies could import gold on condition that 20 per cent of the shipment would be exported and the remainder kept for domestic use. Permission for subsequent imports would be given on fulfilment of the export obligation. So far, only six banks and three financial institutions were allowed to import gold under the 80:20 scheme. On a consignment basis, 21 banks, as permitted by the RBI, can import gold and silver.",Positive
55,India allows more banks to import gold,http://www.dawn.com/news/1094245/india-allows-more-banks-to-import-gold,Dawn,"India's central bank has allowed gold imports by HDFC Bank, Axis Bank, Kotak Mahindra Bank, Indus Ind Bank and Yes Bank, officials at the respective banks told Reuters. Two industry sources confirmed the names of the banks. They and the bank ...",2014-03-20T07:50:02Z,"India has allowed five domestic private sector banks to import gold, in what industry officials say could be a significant step towards easing of tough curbs on the metal imposed last year to cut the country’s trade deficit. The move could boost gold supplies and bring down premiums for the metal in the world’s second-biggest consumer after China. India’s central bank has allowed gold imports by HDFC Bank, Axis Bank, Kotak Mahindra Bank, Indus Ind Bank and Yes Bank, officials at the respective banks told Reuters. Two industry sources confirmed the names of the banks. They and the bank officials did not want to be named as they are not authorised to speak to media. India enforced the so-called 80/20 rule in July, making it mandatory to export a fifth of all gold imports. Under that rule, only six banks and three state-run trading agencies that had facilitated export of gold or jewellery in the past three years were allowed to import. The six banks were mostly state-run lenders. The Reserve Bank of India — the central bank — has now permitted gold imports within prescribed limits by the private banks even though they had not facilitated any exports of metal or jewellery in the past three years. “They have decided upon limits on quantities depending upon the number of (current) customers you have for exports,” said Shekhar Bhandari, executive vice-president of Kotak Mahindra Bank. The Reserve Bank of India did not immediately respond to a request for comment. The move to allow more banks to import gold may raise shipments to about 40 tonnes per month from more than 20 in February, industry officials said. India used to ship in as much 70 tonnes per month, the biggest import after oil that had pushed the current account deficit (CAD) to a record high in the year ended March 2013. “Supplies will be smooth from now and I think premiums will come down,” said Haresh Soni, chairman of the All India Gems and Jewellery Trade Federation. “This looks like just a beginning to the further easing of 80/20 rule.” India used to be the No. 1 buyer of gold before the levy of a record 10 per cent import tax in stages and other restrictions led to a sharp cut. Premiums hit a record of $160 an ounce in December, triggering smuggling and forcing industry officials to call for a repeal of the curbs. Further major relaxations of the curbs are likely only after a new government is formed around June, officials involved with policy making said.",Positive
