ID,Title,Url,Source,Description,Date,Article,Sentiment
56,Technicals with Angel Broking: It has become a buy-on-dips market,http://www.moneyguruindia.com/article.php?cid=6863,MoneyGuru India,"Liquid counters where the cost of carry is high are Unitech, NHPC, HDFC Bank, GMR Infra and IFCI. Stocks with negative cost of carry are Bhel, Ashok Leylands, SAIL, Axis Bank and HCL Tech. When the cost of carry turn negative, the cost of holding a ...",2014-03-30T23:58:51Z,"The opening session on Monday started slightly higher over the previous week's closing, considering strong cues from other Asian bourses. Right from the initial trade, we observed immense buying interest among market participants, which resulted in a rally of nearly one-and-a-half per cent on Nifty; the index ended the session at the highest point of the day. The bulls maintained their optimism for the rest of the week, ignoring unfavourable global developments. In this process, our markets managed to conquer all intermediate resistance levels and closed at the highest point of the week. On a weekly basis, the capital goods, banking, PSU and oil & gas counters propelled the rally; whereas defensive sectors like IT and healthcare trimmed further to close on the losing side. Sensex and Nifty ended the week with sizable gains of 2.69 per cent and 3.09 per cent, respectively, over the previous week's closing. The '89-day exponential moving average' and the '89-week exponential moving average' are placed at 21,046/6,265 and 19,714/5,903 levels, respectively. The '20-day exponential moving average' and the '20-week exponential moving average' are placed at 21,761/6,493 and 21,061/6,272 levels, respectively. All the five sessions of the just-concluded week ended in the positive territory as the bulls were unwilling to leave their driving seat. On the first day of the week, Nifty witnessed a breakout from its nine-day-long congestion zone and as expected, moved beyond the 161 per cent Fibonacci retracement level (calculated from 6,355.60 to 5,933.30) of 6,620 to reach the initial target of 6,700. The optimism was so strong that our market even overlooked the derivative expiry session and gave a genuine up move, barring the last half an hour of the session. Nifty has now closed at a record high and is almost on the verge of confirming a monthly 'Horizontal Line' breakout. This breakout gives much higher targets and hence, we reiterate that it has become a buy-on-dip market, considering 4-6 months' time horizon. But from a near-term perspective, we continue to mention 6,750-6,800 levels, which are one-and-a-half per cent away from the current level. We may not have a proper trade set in the index and hence, we advise traders to shift their focus on stock-specific moves. On the flip side, 6,643 - 6,575 levels would now act as immediate support levels for the index. Nifty spot closed at 6,695.90 this week, against a close of 6,494.90 last week. The put-call ratio has decreased from 1.03 to 0.87 level and the annualised cost of carry is positive 6.61%. The Open Interest of Nifty futures decreased by 27 per cent. PCR-OI has decreased from 1.03 to 0.87 last week. This ratio has mainly decreased due to significant buildup in call options. In call options, huge buildup was seen the 6,700-7,100 range, while in put options significant buildup was seen in the 6,400-6,700 strike range. The maximum build-up is currently accumulated at 6,700 call and 6,400 put of this series. Total open interest of the market has decreased from Rs 1,74,182 crore to Rs 1,18,964 crore. Stock futures open interest has decreased from Rs 40,034 crore to Rs 35,964 crore. Largecap names which added significant positions last week are PNB, Cairn, Hindalco, Reliance and DLF. On the other hand unwinding was visible in counters like HeroMotoCorp, Tata Motors, Sun Pharma, M&M and Infosys. The implied volatility (IV) for Nifty has increased from 13.02 per cent to 15.44 per cent. Historical volatility (HV) is at 14.43 per cent and that for Bank Nifty is trading at 28.97 per cent. Liquid counters having very high HV are JP Power, Adani Power, Ashok Leylands,JP Associates and HDIL. Stocks where HV are on lower side are Cairn, ITC, HUL, Dabur and Oracle Financial Services. Nifty current month futures closed at a premium of 32.75 points against the premium of 66.55 points to its spot. Next month future is trading with premium of 69.45 points. Liquid counters where the cost of carry is high are Unitech, NHPC, HDFC Bank, GMR Infra and IFCI. Stocks with negative cost of carry are Bhel, Ashok Leylands, SAIL, Axis Bank and HCL Tech. When the cost of carry turn negative, the cost of holding a security exceeds the yield earned, thus the investor is losing money.",Negative
57,"Nifty ends March series above 6600; SBI, Bharti big gainers",http://www.domain-b.com/investments/markets/general/20140327_markets.html,Domain-b,"About 1537 shares have advanced, 969 shares declined, and 158 shares are unchanged. SBI, Bharti Airtel, BHEL, Hero Motocorp and Axis Bank are top gainers in the Sensex. Among the losers are Dr Reddy's Labs, TCS, ONGC, Wipro and Sun Pharma. Sakthi Siva of ...",2014-03-27T10:47:51Z,"Shares ofIndia Cements falls 2 percent as Supreme Court,during the hearing on IPL case, has maintained that any person having any relation with the company should not be allowed to function in BCCI. N Srinivasan has offered to step aside as BCCI President. SC has also suggested that Sunil Gavaskar be appointed as the BCCI president.  SC has proposed that CSK and Rajasthan Royals not be allowed to participate in IPL. Hearing in the IPL spot fixing case will continue in the Supreme Court tomorrow. The market surges ahead of expiry today. The Sensex is up 111.92 points at 22207.22, and the Nifty is up 40.15 points at 6641.55. About 1537 shares have advanced, 969 shares declined, and 158 shares are unchanged. SBI, Bharti Airtel, BHEL, Hero Motocorp and Axis Bank are top gainers in the Sensex. Among the losers are Dr Reddy's Labs, TCS, ONGC, Wipro and Sun Pharma. Sakthi Siva of Credit Suisse tells CNBC-TV18 that they are overweight on India and expects 15-20 percent returns from Indian equities. She valuations of Indian market is slightly expensive but not excessive. Sesa Sterlite is in focus as Supreme Court panel recommends mining to be permitted in Goa with a cap of twenty million tonnes per annum. The Supreme Court is likely to implement the recommendations today.",Positive
58,Sensex at lifetime high during close,http://www.saharasamay.com/business-news/676550792/sensex-at-new-fiscal-year-high-bse-benchmark-index-sensex-bse-in.html,SaharaSamay,"The IT sector index gained the most by rising 1.65 per cent to 8,934.45. The consumer durable was second best performer by adding 1.33 per cent to 6,612.63. Axis Bank, HDFC, Dr Reddy's Lab, ONGC, NTPC, Sesa Sterlite and Tata Motors were among major gainers.",2014-04-01T05:48:25Z,"The wide-based National Stock Exchange index Nifty also set a new record high level by rising 16.85 points, or 0.25 per cent to 6,721.05, after an intra-day record of 6,732.25. RBI kept key policy rates unchanged since retail inflation still remains ""sticky"" but introduced steps to increase liquidity and contain volatility in the money market. A higher opening in Europe supported the trading sentiment in later part of the session, brokers said. In 30-BSE index components, 15 stocks gained and 14 ended with losses, while Sun Pharma held unchanged. IT stocks, led by Wipro, TCS and Infosys, were the star performers in the current rally. The IT sector index gained the most by rising 1.65 per cent to 8,934.45. The consumer durable was second best performer by adding 1.33 per cent to 6,612.63. Axis Bank, HDFC, Dr Reddy's Lab, ONGC, NTPC, Sesa Sterlite and Tata Motors were among major gainers.",Positive
59,"Sensex Snaps Six-Day Rally, Ends 42 Points Lower",http://news.outlookindia.com/items.aspx?artid=835399,News Outlook India,"Gail India was down 2.23 per cent. Another public sector company Coal India too lost 2.21 per cent. SBI ended 1.97 per cent lower, Axis Bank 1.96 per cent. Bharti Airtel, Tata Steel and ONGC all lost over 1 per cent each. HUL rose by 1.89 per cent ...",2014-04-03T04:13:00Z,"Markets today retreated from all- time high levels, with BSE benchmark Sensex closing over 42 points lower to register the first fall in seven days on profit-booking in banking, refinery and capital goods shares. In early trade, the bellwether index soared to all-time high of 22,620.65 on initial buying on the back of foreign capital inflows. The is the ninth day in a row the key index is registering a fresh life-time high intra-day. In choppy trade, it declined to day's low of 22,369.28 before settling at 22,509.07, a loss of 42.42 points or 0.19 per cent from its previous close. The 50-share NSE Nifty also fell by 16.45 points to finish at 6,736.10 after registering all- time peak of 6,776.75 in early trade. Rising on the back of steady fund inflows, the Sensex on March 24 closed above 22,000 for the first time ever. The total gain for the Sensex in the previous six days is 496.28 points or 2.25 per cent. Many had attributed the surge in markets to sustained FII inflows on hopes of a stable government coming to power at the Centre after general elections. Finance Minister P Chidambaram had claimed last week that markets were rallying on account of the UPA government's corrective measures for the economy. Bank stocks fell today after the Reserve Bank of India (RBI) yesterday clarified that the option for spreading the mark-to- market losses over the three quarters ended on March 31, 2014 and no further extension is allowed, brokers said. Foreign Institutional Investors (FIIs) bought shares worth a net Rs 594.67 crore yesterday, as per the provisional data from the stock exchanges. ""The domestic bourses traded in the red as investors opted to book profit after recent advances. However, recovery in later half significantly pared losses as a result the benchmarks managed to close slightly on the negative note,"" said Jayant Manglik, President, Retail Distribution, Religare Securities. Of 30 Sensex stocks, 17 ended lower, while 13 finished higher. State-run power equipment maker BHEL suffered a loss 3.20 per cent, the biggest among Sensex scrips. Gail India was down 2.23 per cent. Another public sector company Coal India too lost 2.21 per cent. SBI ended 1.97 per cent lower, Axis Bank 1.96 per cent. Bharti Airtel, Tata Steel and ONGC all lost over 1 per cent each. HUL rose by 1.89 per cent, followed by Cipla at 1.65 per cent. Dr Reddy's Lab gained 1.50 per cent, HDFC 0.70 per cent. Among the S&P BSE sectoral indices bankex fell by 1.09 per cent, followed by Oil&Gas 0.87 per cent, CG 0.83 per cent, Realty 0.44 per cent and Power 0.44 per cent. Healthcare was firmed up by 0.95 per cent and FMCG 0.44 per cent. The market breadth turned negative as 1,511 stocks finished in the red, 1,277 stocks ended in the green and 131 ruled steady. The total turnover dropped to Rs 2,967.41 crore from Rs 3,290.90 crore yesterday. Asian stocks showed a mixed trend even after data showed US companies added workers and China outlined economic stimulus plans. Key benchmark indices in Hongkong, Japan and Singapore moved up by 0.18-0.85 per cent, while indices in China, South Korea and Taiwan eased by 0.18-0.74 per cent. European markets were trading lower in their early trade before European Central Bank's (ECB) rate decision. Key indices in France, Germany and UK declined by 0.03-0.12 per cent.",Negative
60,Asha for home buyers,http://www.telegraphindia.com/1140403/jsp/business/story_18149452.jsp,The Telegraph,"Mumbai, April 2: Axis Bank today launched Asha Home Loan â€” a new product targeted at the first-time home buyer in the lower income segment. The countryâ€™s third-largest private bank is planning to target the 2.5 crore households who draw income of less ...",2014-04-02T20:13:23Z," Axis Bank today launched Asha Home Loan — a new product targeted at the first-time home buyer in the lower income segment. The country’s third-largest private bank is planning to target the 2.5 crore households who draw income of less than Rs 25,000 per month. At present, the size of the housing finance segment in India is estimated at Rs 7 lakh crore worth of oustandings. But most players tend to focus on customers whose monthly income is above Rs 25,000 per month. Jairam Sridharan, head of consumer lending and payments at Axis Bank, said one of the key attractions of the new product was that it would give loans for amounts as low as Rs 1 lakh and up to Rs 15 lakh in small towns (population less 10 lakh) and up to Rs 25 lakh in larger towns where the population is over 10 lakh. Further, the equated monthly instalment (EMI) will be spread over a period of 30 years, which will put a stress-free repayment burden on the customer. The lender will extend finance for a house of even 325 square feet. Most home loan financiers stipulate that the house size should be at least 600 square feet. The Asha Home Loans product design and structure is the outcome of an extensive research conducted by the bank on the lower income customers in India. These loans are meant for customers with family incomes of Rs 8,000 to Rs 10,000 per month and above. Moreover, the customers can pool their family income instead of depending on an individual. The Asha Home Loan, which is available to both salaried and self-employed individuals, can be taken in both floating and fixed rate options. It also entails simple documentation. While the interest rate for the floating rate home loan has been set at 10.75 per cent, it will be 11.75 per cent for the fixed loan. “We see tremendous potential in the affordable housing segment. Customers with lower income level and aspiring to own their first house in the peripheral areas of tier1 cities or within tier II and III cities has largely remained untapped. Asha Home Loan will help to bridge this gap,” Sridharan said.",Positive
61,Nupur Acharya,http://topics.wsj.com/person/A/nupur-acharya/7511,Wall Street Journal,"Dahiya, president of human resources at Axis Bank Ltd.. He explains what Axis looks for in new hires. Banks Rally on Hope Bad-Loan Fever Has Broken March 30, 2014 11:38 p.m. A sharp rebound in Indian bank stocks shows growing optimism that a scary season ...",2014-04-01T01:59:21Z,"Jobs in India’s banking sector are set to grow over the next few years as the country allows new banks to set up shop, says Rajesh K. Dahiya, president of human resources at Axis Bank Ltd., India’s third largest private sector bank by assets after ICICI Bank Ltd.532174.BY -1.04% and HDFC Bank Ltd.500180.BY -0.17%. Around two dozen industrial houses have applied to India’s central bank for permission to start banking operations, and a decision on their application is expected in the coming weeks. To begin with, the new banks are likely to poach employees from existing banks such as Axis, but Mr. Dahiya says that in the long term, they’ll need to train new staff. “The available pool of bankers in the country will increase,” Mr. Dahiya told The Wall Street Journal in a recent interview.",Positive
62,India allows more banks to import gold in easing of curbs,http://finance.yahoo.com/news/india-allows-more-banks-import-114153360.html,Yahoo Finance,"The Reserve Bank of India (RBI) has allowed gold imports by HDFC Bank (NSI:HDFCBANK.NS - News), Axis Bank (NSI:AXISBANK.NS - News), Kotak Mahindra Bank (NSI:KOTAKBANK.NS - News), IndusInd Bank (NSI:INDUSINDBK) and Yes Bank (NSI:YESBANK.NS - News ...",2014-03-19T11:40:17Z,"India has allowed five domestic private sector banks to import gold, in what industry officials say could be a significant step towards easing of tough curbs on the metal imposed last year to cut the country's trade deficit. The move could boost gold supplies and bring down premiums for the metal in the world's second-biggest consumer after China. The Reserve Bank of India (RBI) has allowed gold imports by HDFC Bank (NSI:HDFCBANK.NS - News), Axis Bank (NSI:AXISBANK.NS - News), Kotak Mahindra Bank (NSI:KOTAKBANK.NS - News), IndusInd Bank (NSI:INDUSINDBK) and Yes Bank (NSI:YESBANK.NS - News), officials at the respective banks told Reuters. Two industry sources confirmed the names of the banks. They and the bank officials did not want to be named as they are not authorised to speak to media. India enforced the so-called 80/20 rule in July, making it mandatory to export a fifth of all gold imports. Under that rule, only six banks and three state-run trading agencies that had facilitated export of gold or jewellery in the past three years were allowed to import. The six banks were mostly state-run lenders. The RBI has now permitted gold imports within prescribed limits by the private banks even though they had not facilitated any exports of metal or jewellery in the past three years. ""They have decided upon limits on quantities depending upon the number of (current) customers you have for exports,"" said Shekhar Bhandari, executive vice-president of Kotak Mahindra Bank. The RBI did not immediately respond to a request for comment. The move to allow more banks to import gold may raise shipments to about 40 tonnes per month from more than 20 in February, industry officials said. India used to ship in as much 70 tonnes per month, the biggest import after oil that had pushed the current account deficit (CAD) to a record high in the year ended March 2013. ""Supplies will be smooth from now and I think premiums will come down,"" said Haresh Soni, chairman of the All India Gems and Jewellery Trade Federation. ""This looks like just a beginning to the further easing of 80/20 rule.""",Positive
63,Tokyo Leads Asian Gains,https://sg.finance.yahoo.com/news/tokyo-leads-asian-gains-054500510.html,Yahoo Singapore Finance,"ICICI Bank, Tata Motors, RIL, NTPC, Cipla, Tata Power, and HDFC all gained over a percent each. Axis Bank was down 1.6% after the regulator said foreign institutional investors, or FIIâ€™s, will not be allowed to buy more shares in the lender as the total ...",2014-04-02T05:40:05Z,"The Nikkei led gains for the Asian markets Tuesday following a positive finish on Wall Street overnight. The Nikkei gained 1.4%. The Shanghai Composite was up 0.2% along with the Hang Seng. The Sensex moved up 0.3% while the All Ordinaries also added 0.3%. Data earlier today in Australia showed approvals to build new homes fell more-than-expected last week to a seasonally adjusted 5% from 6.9% in the preceding week. Renesas Electronics surged 6.5% after a report the company may sell its chip-making unit for smartphone displays. Renesas responded in a statement saying the report was not based on something it had previously announced but they were considering various options for the unit. Auto stocks were smartly higher on a combination of some upbeat sales figures in the U.S. and a weak yen. Toyota gained slightly over a percent while Honda and Nissan were both up about 2% each. Mazda revved up 3.7%. Fuji Heavy Industries gained 2.9%, helped by a 21% increase in sales of its Subaru brand. Other exporters were also all higher. Kyushu Electric dropped over 5% on a Nikkei report the utility is in talks with the Development Bank of Japan to secure a 100 billion yen investment. Property stocks advanced in Hong Kong and on the mainland. Poly Real Estate was up 7% in Shanghai after it said late Monday 2013 net income and revenue were up 27% and 34% each, respectively. The Sensex hit yet another lifetime high in morning trade with Airtel the top gainer on the Sensex, up 3.8%. ICICI Bank, Tata Motors, RIL, NTPC, Cipla, Tata Power, and HDFC all gained over a percent each. Axis Bank was down 1.6% after the regulator said foreign institutional investors, or FII’s, will not be allowed to buy more shares in the lender as the total holding by FII’s had already breached the overall limit of 49%.",Negative
65,Opening Bell 21 March | Global markets rebound,http://origin-www.livemint.com/Money/fMr8gyYxe8V0gNL2NOwSWN/Opening-Bell-21-March--Global-markets-rebound.html,Live Mint & Wall Street Journal,Industry officials expect this trend to gain pace in the coming months. Axis Bank Ltd shares will be in focus as the government will sell 9% of its stake via block deals on Friday. The government will offload around 42.2 million Axis Bank shares that are ...,2014-03-21T02:12:24Z,"Global markets are rebounding after exaggerated declines on Wednesday following Janet Yellen’s first meeting as chief of the Federal Reserve where she indicated that interest rates would rise by next year. In the US, the S&P 500 rebounded by 0.6%, buoyed by decent jobless claims data and an upbeat manufacturing report from the Philadelphia region, reports Financial Times. The Nasdaq Composite gained 0.3% and Dow Jones Industrial Average advanced 0.7%. Asian markets were trading mixed on Friday morning following firm cues from Wall Street. Hong Kong’s Hang Seng gained 0.3% and China’s Shanghai Composite was off 0.3%. Japan’s Nikkei Stock Average was shut on account of a holiday. Infosys Ltd shares will be under pressure after the tech major witnessed yet another top-level exit with senior vice-president and company veteran Chandrashekar Kakal resigning on Thursday for reasons that weren’t specified. This marks the ninth top-level exit at Infosys after N. R. Narayana Murthy returned to resurrect its fortunes in June. Gold jewellery exports from India rose for the first time in the fiscal year last month, up one percentage point in February to $718.36 million from a year earlier, helped by better availability of gold. Industry officials expect this trend to gain pace in the coming months. Axis Bank Ltd shares will be in focus as the government will sell 9% of its stake via block deals on Friday. The government will offload around 42.2 million Axis Bank shares that are held by Specified Undertaking of the Unit Trust of India, reducing its 20.72% stake.",Average
66,Asian Morning Briefing: U.S. Stocks Rally,http://online.wsj.com/article/SB10001424052702304756104579451713807438006.html,The Wall Street Journal,Revenue grew to $6.97 billion. Indian Government to Sell Part of Axis Bank Stake The Indian government is said to be trying to sell a stake in Axis Bank that could be valued at as much as $937 million. Symantec Fires CEO Steve Bennett Symantec ...,2014-03-21T03:16:50Z,"The government has launched its sale offer on a 9 percent stake in Axis Bank Ltd (AXBK.NS) that could raise up to $935 million, two sources with direct knowledge of the development said on Thursday. The government holds in total 20.7 percent of Axis Bank, India's third-largest private-sector bank by assets, via a trust fund called Specified Undertaking of the Unit Trust of India (SUUTI). The share sale is part of the government's campaign to raise revenues and meet its revised fiscal deficit target of 4.6 percent of gross domestic product in the financial year ending on March 31. The indicative price band for the Axis Bank share sale has been set at roughly 1,290 rupees to 1,357 rupees a share, said the sources, a discount of as much as 5 percent from its closing price on Thursday of 1,357.35 rupees. The sources declined to be named as they were not authorised to speak to the media. India's finance ministry officials were not immediately available for comments. The government, through the Special Undertaking of Unit Trust of India, also has stakes in cigarette maker ITC Ltd (ITC.NS) and engineering and construction firm Larsen & Toubro Ltd (LART.NS). Citigroup Inc (C.N), JPMorgan Chase & Co (JPM.N) and India's JM Financial Ltd were appointed by the government in January to manage the stake sale.",Average
